{
  "schema_version": 1,
  "gates": {
    "require_change": true,
    "preserve_ids": ["I3"]
  },
  "checks": [
    {
      "id": "hello_frame_added",
      "type": "min_added_under",
      "parent_id": "I2",
      "min": 1,
      "required": true
    }
  ],
  "weights": {
    "checks": 0.5,
    "gates": 1.0,
    "design_system": 0.2,
    "visual": 0.3,
    "heuristics": 0.05
  }
}
